{
  "@context": {
    "@vocab": "https://schema.org/",
    "flare": "https://proofs.africa/ns/participant#"
  },
  "@type": "Organization",

  "name": "African Proofs",
  "description": "FTSO data provider and blockchain infrastructure lab on the Flare network. ML-powered price predictions, validator, FDC operations, FAssets research.",
  "url": "https://www.proofs.africa",

  "logo": "https://proofs.africa/logo-256.png",
  "flare:brand": {
    "light": "https://proofs.africa/logo-light.svg",
    "dark": "https://proofs.africa/logo-dark.svg",
    "icon": "https://proofs.africa/icon-512.png"
  },

  "flare:participant-type": 0,
  "flare:participant-type-label": "Provider",

  "flare:social": {
    "twitter": "africanproofs",
    "telegram": "africanproofs"
  },

  "flare:location": {
    "country": "ZA"
  },

  "flare:networks": [
    { "id": "flare",    "services": ["ftso", "fdc", "validator"] },
    { "id": "songbird", "services": ["ftso", "fdc", "fast-updates", "validator"] }
  ],

  "flare:nodes": [
    { "network": "flare",    "role": "validator", "country": "ZA" },
    { "network": "songbird", "role": "observer",  "country": "ZA" }
  ]
}
